<?xml version="1.0" encoding="UTF-8"?>
<action xmlns:xsi="http://www.w3.org/2001/XMLSchema-instance" xsi:noNamespaceSchemaLocation="../ActionsSchema.xsd">
	<paramNull></paramNull>
	<errorOnRemainder></errorOnRemainder>
	<keypair>
		<key value = "type"/>
		<value value="alter"/>
	</keypair>
	<keypair>
		<key value="target"/>
		<value value="params" index="0"/>
	</keypair>
	<keypair>
		<key value="stat"/>
		<value value="params" index="1"/>
	</keypair>	
	<keypair>
		<key value="mode"/>
		<value value="params" index="2"/>
	</keypair>
	<keypair>
		<key value="value"></key>
		<value value="remainder"></value>
	</keypair>
	<maxParam value="3"></maxParam>
	<minParam value="3"></minParam>
</action>