<?xml version="1.0" encoding="UTF-8"?>
<action xmlns:xsi="http://www.w3.org/2001/XMLSchema-instance" xsi:noNamespaceSchemaLocation="../ActionsSchema.xsd">
	<keypair>
		<key value="type"></key>
		<value value="INSPECTQUEST"></value>
	</keypair>
	<keypair>
		<key value="target"></key>
		<value value="params" index="0"></value>
	</keypair>
	<keypair>
		<key value="quest_slot"></key>
		<value value="params" index="1"></value>
	</keypair>
	<maxParam value="2"></maxParam>
	<minParam value="2"></minParam>
</action>