<?xml version="1.0" encoding="UTF-8"?>
<action xmlns:xsi="http://www.w3.org/2001/XMLSchema-instance" xsi:noNamespaceSchemaLocation="../ActionsSchema.xsd">
	<keypair>
		<key value="type"></key>
		<value value="teleportto"></value>
	</keypair>
	<keypair>
		<key value="target"></key>
		<value value="remainder"></value>
	</keypair>
	<maxParam value="0"></maxParam>
	<minParam value="0"></minParam>
</action>