<?xml version="1.0" encoding="UTF-8"?>
<action xmlns:xsi="http://www.w3.org/2001/XMLSchema-instance" xsi:noNamespaceSchemaLocation="../ActionsSchema.xsd">
	<keypair>
		<key value = "type"/>
		<value value="adminlevel"/>
	</keypair>
	<keypair>
		<key value="target"/>
		<value value="params" index="0"/>
	</keypair>
	<keypair optional="1">
		<key value="newlevel"></key>
		<value value="params" index="1"></value>
	</keypair>

	<maxParam value="2"></maxParam>
	<minParam value="1"></minParam>
</action>