<?xml version="1.0" encoding="UTF-8"?>
<action xmlns:xsi="http://www.w3.org/2001/XMLSchema-instance" xsi:noNamespaceSchemaLocation="../ActionsSchema.xsd">
	<paramNull></paramNull>
	<keypair>
		<key value = "type"/>
		<value value="challenge"/>
	</keypair>
	<keypair>
		<key value = "action"/>
		<value value="open"/>
	</keypair>
	<keypair>
		<key value="target"/>
		<value value="params" index="0"/>
	</keypair>
	<maxParam value="1"></maxParam>
	<minParam value="1"></minParam>
</action>